{
  "id": "22222222-2222-4222-8222-222222222222",
  "owner_id": "11111111-1111-4111-8111-111111111111",
  "schema_version": "1.0.0",
  "revision": 1,
  "created_at": "2026-09-05T00:00:00Z",
  "updated_at": "2026-09-05T00:00:00Z",
  "title": "Test character",
  "visibility": "private",
  "archived": false,
  "release_ids": [],
  "draft": {}
}
