{
  "id": "22222222-2222-4222-8222-222222222222",
  "owner_id": "11111111-1111-4111-8111-111111111111",
  "schema_version": "1.0.0",
  "revision": 2,
  "created_at": "2026-09-05T00:00:00Z",
  "updated_at": "2026-09-05T00:00:00Z",
  "title": "Unfinished draft",
  "visibility": "private",
  "archived": false,
  "release_ids": [],
  "draft": {
    "age": {
      "knowledge_status": "unknown",
      "authority": "default",
      "lifetime": "core",
      "provenance": {
        "source_type": "system",
        "effective_revision": 1
      }
    },
    "identity": {
      "display_name": "Working title"
    }
  }
}
